name	source	about	first_release	types	paradigms	website
easy pl/i	https://en.wikipedia.org/wiki/PL/I	PL/I (Programming Language One, pronounced /piː ɛl wʌn/ and sometimes written PL/1)[2] is a procedural, imperative computer programming language developed and published by IBM. It is designed for scientific, engineering, business and system programming. It has been used by academic, commercial and industrial organizations since it was introduced in the 1960s, and is still used.[3]	1964		['Procedural', 'imperative', 'structured']	http://bitsavers.trailing-edge.com/pdf/ibm/360/pli/
easytrieve plus	https://en.wikipedia.org/wiki/Easytrieve	CA Technologies, formerly known as CA, Inc. and Computer Associates International, Inc., is an American multinational corporation headquartered in New York City. Since November 5, 2018, the company has been a subsidiary of Broadcom Inc.[6]				http://www.ca.com/
ec	https://en.wikipedia.org/wiki/EC_(programming_language)	eC (Ecere C) is an object-oriented programming language, defined as a super-set of the C language.	2004	['Static', 'nominative', 'partially inferred']	['Multi-paradigm', 'procedural', 'object-oriented', 'generic']	http://ec-lang.org/
ecmascript	https://en.wikipedia.org/wiki/ECMAScript	ECMAScript (/i.si.ɛmˈeɪskrɪpt/) (or ES)[1] is a general-purpose programming language, standardized by Ecma International according to the document ECMA-262. It is a JavaScript standard meant to ensure the interoperability of Web pages across different Web browsers.[2] ECMAScript is commonly used for client-side scripting on the World Wide Web, and it is increasingly being used for writing server applications and services using Node.js.	1997	['weak', 'dynamic']	['Multi-paradigm', 'prototype-based', 'functional', 'imperative']	http://www.ecma-international.org/
edinburgh imp	https://en.wikipedia.org/wiki/Edinburgh_IMP	Edinburgh IMP is a development of Atlas Autocode, initially developed around 1966-1969 at the University of Edinburgh, Scotland. It is a general-purpose programming language which was used heavily for systems programming.	1966	['Static', 'strong']	['Procedural', 'imperative', 'structured']	
egl	https://en.wikipedia.org/wiki/EGL_(programming_language)	EGL (Enterprise Generation Language), originally developed by IBM and now available as the EDT (EGL Development Tools)[1] open source project under the Eclipse Public License (EPL), is a programming technology designed to meet the challenges of modern, multi-platform application development by providing a common language and programming model across languages, frameworks, and runtime platforms.				http://www.eclipse.org/edt/
eiffel	https://en.wikipedia.org/wiki/Eiffel_(programming_language)	Eiffel is an object-oriented programming language designed by Bertrand Meyer (an object-orientation proponent and author of Object-Oriented Software Construction) and Eiffel Software. Meyer conceived the language in 1985 with the goal of increasing the reliability of commercial software development;[5] the first version becoming available in 1986. In 2005, Eiffel became an ISO-standardized language.	1986	['static']	['Object-oriented', 'Class-based', 'Generic', 'Concurrent']	https://www.eiffel.org/
elan	https://en.wikipedia.org/wiki/ELAN_(programming_language)	ELAN is an educational programming language for learning and teaching systematic programming.	1974			https://www.cs.ru.nl/elan/
elixir	https://en.wikipedia.org/wiki/Elixir_(programming_language)	Elixir is a functional, concurrent, general-purpose programming language that runs on the BEAM virtual machine used to implement the Erlang programming language.[3] Elixir builds on top of Erlang and shares the same abstractions for building distributed, fault-tolerant applications. Elixir also provides productive tooling and an extensible design. The latter is supported by compile-time metaprogramming with macros and polymorphism via protocols.[4]	2011	['dynamic', 'strong', 'duck']	['multi-paradigm', 'functional', 'concurrent', 'distributed', 'process-oriented']	https://elixir-lang.org/
elm	https://en.wikipedia.org/wiki/Elm_(programming_language)	"Elm is a domain-specific programming language for declaratively creating web browser-based graphical user interfaces. Elm is purely functional, and is developed with emphasis on usability, performance, and robustness. It advertises ""no runtime exceptions in practice"",[6] made possible by the Elm compiler's static type checking."	2012	['Static', 'Strong', 'Inferred']	['Functional']	https://elm-lang.org/
emacs lisp	https://en.wikipedia.org/wiki/Emacs_Lisp	Emacs Lisp is a dialect of the Lisp programming language used as a scripting language by Emacs (a text editor family most commonly associated with GNU Emacs and XEmacs). It is used for implementing most of the editing functionality built into Emacs, the remainder being written in C, as is the Lisp interpreter. Emacs Lisp is also termed Elisp, although there is also an older, unrelated Lisp dialect with that name.[1]	1985	['Dynamic', 'strong']	['Functional', 'meta', 'reflective']	
emerald	https://en.wikipedia.org/wiki/Emerald_(programming_language)	Emerald is a distributed, object-oriented programming language developed in the 1980s by Andrew P. Black, Norman C. Hutchinson, Eric B. Jul, and Henry M. Levy, in the Department of Computer Science at the University of Washington.[1]	1980	['strong', 'static']	['object-oriented']	http://www.emeraldprogramminglanguage.org/
epigram	https://en.wikipedia.org/wiki/Epigram_(programming_language)	Epigram is a functional programming language with dependent types, and the integrated development environment (IDE) usually packaged with the language. Epigram's type system is strong enough to express program specifications. The goal is to support a smooth transition from ordinary programming to integrated programs and proofs which correctness can be checked and certified by the compiler. Epigram exploits the Curry–Howard correspondence, also termed the propositions as types principle, and is based on intuitionistic type theory.	2004	['strong', 'static', 'dependent']	['Functional']	https://web.archive.org/web/20120717070845/http://www.e-pig.org/darcs/Pig09/web/
epl	https://en.wikipedia.org/wiki/Easy_Programming_Language	Easy Programming Language (EPL, Chinese: 易语言) is a visual compiled multilingual[1] proprietary programming language. EPL is somewhat popular in China because it features a full Chinese environment. (The language has traditional Chinese, simplified Chinese, English and Japanese variants.)	2004		['Multi-paradigm', 'compiled', 'imperative', 'procedural', 'object-oriented', 'functional']	http://epl.eyuyan.com/
epl	https://en.wikipedia.org/wiki/Eltron_Programming_Language	Eltron Programming Language (EPL) is a printer control language used to produce printed labels for various Eltron model printers.				
erlang	https://en.wikipedia.org/wiki/Erlang_(programming_language)	Erlang (/ˈɜːrlæŋ/ UR-lang) is a general-purpose, concurrent, functional programming language, and a garbage-collected runtime system. The term Erlang is used interchangeably with Erlang/OTP, or Open Telecom Platform (OTP), which consists of the Erlang runtime system, several ready-to-use components (OTP) mainly written in Erlang, and a set of design principles for Erlang programs.[3]	1986	['Dynamic', 'strong']	['Multi-paradigm', 'concurrent', 'functional']	http://www.erlang.org/
es	https://en.wikipedia.org/wiki/Es_(Unix_shell)	"rc (for ""run commands"") is the command line interpreter for Version 10 Unix and Plan 9 from Bell Labs operating systems. It resembles the Bourne shell, but its syntax is somewhat simpler. It was created by Tom Duff, who is better known for an unusual C programming language construct (""Duff's device"").[1]"	1989	['weak']	['imperative', 'pipeline']	http://doc.cat-v.org/plan_9/4th_edition/papers/rc
escher	https://en.wikipedia.org/wiki/Escher_(programming_language)	"Escher (named for M. C. Escher, ""a master of endless loops"") is a declarative programming language that supports both functional programming and logic programming models, developed by J.W. Lloyd in the mid-1990s. It was designed mostly as a research and teaching vehicle. The basic view of programming exhibited by Escher and related languages is that a program is a representation of a theory in some logic framework, and the program's execution (computation) is a deduction from the theory. The logic framework for Escher is Alonzo Church's simple theory of types."	1990	['static', 'manifest']	['declarative', 'functional', 'logic']	
espol	https://en.wikipedia.org/wiki/Executive_Systems_Problem_Oriented_Language	The Executive Systems Problem Oriented Language (ESPOL) is a programming language, a superset of ALGOL 60, that provides abilities of what would later be termed a system programming language or machine oriented high order language (mohol), such as interrupting a processor on a multiprocessing system (the Burroughs large systems were multiprocessor systems). ESPOL was used to write the Master Control Program (MCP) on Burroughs computer systems from the B5000 to the B6700. The single-pass compiler for ESPOL could compile over 250 lines per second.				
esterel	https://en.wikipedia.org/wiki/Esterel	Esterel is a synchronous programming language for the development of complex reactive systems. The imperative programming style of Esterel allows the simple expression of parallelism and preemption. As a consequence, it is well suited for control-dominated model designs.				
etoys	https://en.wikipedia.org/wiki/Etoys_(programming_language)	Etoys is a child-friendly computer environment and object-oriented prototype-based programming language for use in education.	1996	['dynamic']	['object-oriented', 'prototype-based', 'educational']	
euclid	https://en.wikipedia.org/wiki/Euclid_(programming_language)	Euclid is an imperative programming language for writing verifiable programs. It was designed by Butler Lampson and associates at the Xerox PARC lab in the mid-1970s. The implementation was led by Ric Holt at the University of Toronto and James Cordy was the principal programmer for the first implementation of the compiler. It was originally designed for the Motorola 6809 microprocessor. It was considered innovative for the time; the compiler development team had a $2 million budget over 2 years and was commissioned by the Defense Advanced Research Projects Agency of the U.S. Department of Defense and the Canadian Department of National Defence. It was used for a few years at I. P. Sharp Associates, MITRE Corporation, SRI International and various other international institutes for research in systems programming and secure software systems.	1970	['strong', 'static']	['multi-paradigm', 'structured', 'imperative', 'functional']	
euler	https://en.wikipedia.org/wiki/Euler_(programming_language)	Euler is a programming language created by Niklaus Wirth and Helmut Weber, conceived as an extension and generalization of ALGOL 60.[1][2][3] The designers' goals were to create a language that is:	1965	['dynamic']	['Multi-paradigm', 'procedural', 'imperative', 'structured']	
euphoria	https://en.wikipedia.org/wiki/Euphoria_(programming_language)	Euphoria is a programming language created by Robert Craig of Rapid Deployment Software[1] in Toronto, Ontario, Canada. Initially developed (though not publicly released) on the Atari ST,[2] the first commercial release[3] was for the 16-bit DOS platform and was proprietary. In 2006, with the release of version 3,[4] Euphoria became open-source software. The openEuphoria Group continues to administer and develop the project.[5] In December 2010, the openEuphoria Group released version 4[6] of openEuphoria along with a new identity and mascot for the project. OpenEuphoria is currently available for Windows, Linux, macOS and three flavors of *BSD.	1993		['Imperative, procedural']	http://openeuphoria.org/
euslisp robot programming language	https://en.wikipedia.org/wiki/EusLisp_Robot_Programming_Language	EusLisp is a Lisp-based programming system. Built on the basis of object orientation, it is designed specifically for developing robotics software. The first version of it ran in 1986 on Unix-System5/Ustation-E20.[1]				
cms exec	https://en.wikipedia.org/wiki/CMS_EXEC	CMS EXEC, or EXEC, is an interpreted, command procedure control, computer scripting language used by the CMS EXEC Processor supplied with the IBM Virtual Machine/Conversational Monitor System (VM/CMS) operating system.				
exec 2	https://en.wikipedia.org/wiki/EXEC_2	EXEC 2 is an interpreted, command procedure control, computer scripting language used by the EXEC 2 Processor supplied with the IBM Virtual Machine/System Product (VM/SP) operating system.[1]				
executable uml	https://en.wikipedia.org/wiki/Executable_UML	"Executable UML (xtUML or xUML) is both a software development method and a highly abstract software language. It was described for the first time in 2002 in the book ""Executable UML: A Foundation for Model-Driven Architecture"".[1] The language ""combines a subset of the UML (Unified Modeling Language) graphical notation with executable semantics and timing rules.""[2] The Executable UML method is the successor to the Shlaer–Mellor method.[3]"				
ezhil	https://en.wikipedia.org/wiki/Ezhil_(programming_language)	Ezhil, in Tamil language script (Tamil: எழில், romanized: Eḻil, lit. 'beauty', Tamil pronunciation: [eɻil̪]), is a compact, open source, interpreted, programming language, originally designed to enable native-Tamil speaking students, K-12 age-group to learn computer programming, and enable learning numeracy and computing, outside of linguistic expertise in predominately English language-based computer systems.	2007	['strong', 'dynamic']	['interpreted', 'imperative', 'structured']	http://ezhillang.org/
f	https://en.wikipedia.org/wiki/F_(programming_language)	F is a modular, compiled, numeric programming language, designed for scientific programming and scientific computation.[1] F was developed as a modern Fortran, thus making it a subset of Fortran 95.[2] It combines both numerical and data abstraction features from these languages. F is also backwards compatible with Fortran 77, allowing calls to Fortran 77 programs. F was first included in the g95 compiler.		['static', 'manifest']	['procedural', 'modular']	
f#	https://en.wikipedia.org/wiki/F_Sharp_(programming_language)	F# (pronounced F sharp) is a functional-first, general purpose, strongly typed, multi-paradigm programming language that encompasses functional, imperative, and object-oriented programming methods. F# is most often used as a cross-platform Common Language Infrastructure (CLI) language on .NET Core, but it can also generate JavaScript[9] and graphics processing unit (GPU) code.[10]	2005	['Static', 'strong', 'inferred']	['Multi-paradigm', 'functional', 'imperative', 'object-oriented', 'metaprogramming', 'reflective', 'concurrent']	http://fsharp.org/
f*	https://en.wikipedia.org/wiki/F*_(programming_language)	F* (pronounced F star) is a functional programming language inspired by ML and aimed at program verification. Its type system includes dependent types, monadic effects, and refinement types. This allows expressing precise specifications for programs, including functional correctness and security properties. The F* type-checker aims to prove that programs meet their specifications using a combination of SMT solving and manual proofs. Programs written in F* can be translated to OCaml, F#, and C for execution. Previous versions of F* could also be translated to JavaScript.		['Dependent', 'inferred', 'static', 'strong']	['Multi-paradigm', 'functional', 'imperative']	https://www.fstar-lang.org/
factor	https://en.wikipedia.org/wiki/Factor_(programming_language)	Factor is a stack-oriented programming language created by Slava Pestov. Factor is dynamically typed and has automatic memory management, as well as powerful metaprogramming features. The language has a single implementation featuring a self-hosted optimizing compiler and an interactive development environment. The Factor distribution includes a large standard library.	2003	['strong', 'dynamic']	['multi-paradigm', 'functional', 'concatenative', 'stack-oriented']	http://factorcode.org/
fantom	https://en.wikipedia.org/wiki/Fantom_(programming_language)	"Fantom is a general purpose object-oriented programming language created by Brian and Andy Frank[4] that runs on the Java Runtime Environment (JRE), JavaScript, and the .NET Common Language Runtime (CLR) (.NET support is considered ""prototype""[5] status). Its primary design goal is to provide a standard library API[6] that abstracts away the question of whether the code will ultimately run on the JRE or CLR. Like C# and Java, Fantom uses a curly brace syntax. The language supports functional programming through closures and concurrency through the Actor model. Fantom takes a ""middle of the road"" approach to its type system, blending together aspects of both static and dynamic typing."	2005	['static', 'dynamic']	['multi-paradigm']	http://www.fantom.org/
faust	https://en.wikipedia.org/wiki/FAUST_(programming_language)	FAUST (Functional AUdio STream) is a domain-specific purely functional programming language for implementing signal processing algorithms in the form of libraries, audio plug-ins, or standalone applications. A FAUST program denotes a signal processor: a mathematical function that is applied to some input signal and then fed out.	2002			http://faust.grame.fr/
ffp	https://en.wikipedia.org/wiki/FFP_(programming_language)	"FP (short for functional programming)[2] is a programming language created by John Backus to support the function-level programming[2] paradigm. This allows eliminating named variables. The language was introduced in Backus's 1977 Turing Award paper, ""Can Programming Be Liberated from the von Neumann Style?"", subtitled ""a functional style and its algebra of programs."" The paper sparked interest in functional programming research,[3] eventually leading to modern functional languages, and not the function-level paradigm Backus had hoped."	1977		['Function-level']	
fish	https://en.wikipedia.org/wiki/Friendly_interactive_shell	"fish is a Unix shell that attempts to be more interactive and user-friendly than those with a longer history (i.e. most other Unix shells) or those formulated as function-compatible replacements for the aforementioned (e.g. zsh, the Falstad shell). The design goal of fish is to give the user a rich set of powerful features in a way that is easy to discover, remember, and use.[4] fish is considered an ""exotic shell"",[citation needed] in that its syntax derives from neither the Bourne shell (ksh, Bash, zsh) nor the C shell (csh, tcsh). Also unlike previous shells, which disable certain features by default to save system resources, fish enables all features by default."	2005			http://fishshell.com/
fjölnir	https://en.wikipedia.org/wiki/Fj%C3%B6lnir_(programming_language)	Fjölnir (also Fjolnir or Fjoelnir) is a programming language developed by professor Snorri Agnarsson of computer science at Háskóli Íslands (University of Iceland) that was mostly used in the 1980s. The source files usually have the extension fjo or sma.	1980		['object-oriented']	
fl	https://en.wikipedia.org/wiki/FL_(programming_language)	"FL (short for ""Function Level"") is a programming language created at the IBM Almaden Research Center by John Backus, John Williams, and Edward Wimmers in the 1980s and documented in a report from 1989.[1] FL was designed as a successor of Backus' earlier FP language, providing specific support for what Backus termed function-level programming."	1989	['Dynamic']	['Function-level', 'functional']	
flavors	https://en.wikipedia.org/wiki/Flavors_(programming_language)	Flavors,[1] an early object-oriented extension to Lisp developed by Howard Cannon at the MIT Artificial Intelligence Laboratory for the Lisp machine and its programming language Lisp Machine Lisp, was the first programming language to include mixins.[2] Symbolics used it for its Lisp machines, and eventually developed it into New Flavors; both the original and new Flavors were message passing OO models. It was hugely influential in the development of the Common Lisp Object System (CLOS).[3]				
flex	https://en.wikipedia.org/wiki/Flex_(language)	In computing, the FLEX language was developed by Alan Kay in the late 1960s while exploring ideas that would later evolve into the Smalltalk programming language.[1]				
flix	https://en.wikipedia.org/wiki/Flix_(programming_language)	Flix is a functional, imperative, and logic programming language developed at Aarhus University, with funding from the Independent Research Fund Denmark,[2] and by a community of open source contributors.[3] The Flix language supports algebraic data types, pattern matching, parametric polymorphism, currying, higher-order functions, extensible records,[4] channel and process-based concurrency, and tail call elimination. Two notable features of Flix are its type and effect system[5] and its support for first-class Datalog constraints.[6]		['inferred', 'static', 'strong', 'structural']	['Multi-paradigm', 'functional', 'imperative', 'logic']	https://flix.dev/
floop	https://en.wikipedia.org/wiki/BlooP_and_FlooP	BlooP and FlooP are simple programming languages designed by Douglas Hofstadter to illustrate a point in his book Gödel, Escher, Bach.[1] BlooP is a non-Turing-complete programming language whose main control flow structure is a bounded loop (i.e. recursion is not permitted). All programs in the language must terminate, and this language can only express primitive recursive functions.[2]				
flow-matic	https://en.wikipedia.org/wiki/FLOW-MATIC	FLOW-MATIC, originally known as B-0 (Business Language version 0), was the first English-like data processing language. It was developed for the UNIVAC I at Remington Rand under Grace Hopper from 1955 to 1959, and helped shape the development of COBOL.	1955		['imperative']	
focal	https://en.wikipedia.org/wiki/FOCAL_(programming_language)	FOCAL is an interactive interpreted programming language based on JOSS and primarily used on Digital Equipment Corporation (DEC) PDP-series machines. The name is an acronym for Formulating On-Line Calculations in Algebraic Language,[1] or for FOrmula CALculator.[2]	1968			
focus	https://en.wikipedia.org/wiki/FOCUS	FOCUS is a fourth-generation programming language (4GL) computer programming language and development environment that is used to build database queries. Produced by Information Builders Inc., it was originally developed for data handling and analysis on the IBM mainframe. Subsequently versions for minicomputers and such as the VAX and other platforms[1] were implemented.[2][3] FOCUS was later extended to personal computers and (in 1997) to the World Wide Web: the WebFOCUS product.				
foil	https://en.wikipedia.org/wiki/FOIL_(programming_language)	FOIL was the name for two different programming languages.				
formac	https://en.wikipedia.org/wiki/FORMAC_(programming_language)	FORMAC, the FORmula MAnipulation Compiler, was the first computer algebra system to have significant use.[1] It was developed by Jean E. Sammet and her team, as an extension of FORTRAN IV. The compiler was implemented as a preprocessor taking the FORMAC program and converting it to a FORTRAN IV program which was in turn compiled without further user intervention.				
@formula	https://en.wikipedia.org/wiki/Formula_language	The Formula language is a scripting language used by Lotus Notes. It is often referred to as @Formula language (pronounced at-formula) because many language elements start with the @-character. Here is an example of a selection formula:				
forth	https://en.wikipedia.org/wiki/Forth_(programming_language)	Forth is an imperative stack-based computer programming language and environment originally designed by Chuck Moore. Language features include structured programming, reflection (the ability to examine and modify program structure during execution), concatenative programming (functions are composed with juxtaposition) and extensibility (the programmer can create new commands). Although not an acronym, the language's name is sometimes spelled with all capital letters as FORTH, following the customary usage during its earlier years.	1970	['typeless']	['Procedural', 'stack-oriented', 'reflective', 'concatenative']	
fortran	https://en.wikipedia.org/wiki/Fortran	Fortran (/ˈfɔːrtræn/; formerly FORTRAN, derived from Formula Translation[2]) is a general-purpose, compiled imperative programming language that is especially suited to numeric computation and scientific computing.	1957	['strong', 'static', 'manifest']	['multi-paradigm', 'structured', 'imperative', 'procedural', 'object-oriented', 'generic', 'array']	https://fortran-lang.org/
fortress	https://en.wikipedia.org/wiki/Fortress_(programming_language)	Fortress is a discontinued experimental programming language for high-performance computing, created by Sun Microsystems with funding from DARPA's High Productivity Computing Systems project. One of the language designers was Guy L. Steele Jr., whose previous work includes Scheme, Common Lisp, and Java.	2006	['Static']		https://github.com/stokito/fortress-lang
