name	source	about	first_release	types	paradigms	website
limnor	https://en.wikipedia.org/wiki/Limnor	"Limnor is a generic-purpose codeless and visual programming system. The aim is to enable users to create computer software without directly coding in a texture programming language. It can be extended by software developers. The general idea of Limnor codeless programming is to add ""Actions"" to classes."				
linc	https://en.wikipedia.org/wiki/LINC_4GL	"LINC (""Logic and Information Network Compiler"") is a fourth-generation programming language,[1] used mostly on Unisys computer systems."				
lingo	https://en.wikipedia.org/wiki/Lingo_(programming_language)	Lingo is a verbose object-oriented (OO) scripting language developed by John H. Thompson for use in Adobe Director (formerly Macromedia Director). Lingo is used to develop desktop application software, interactive kiosks, CD-ROMs and Adobe Shockwave content.[1][2]				
linq	https://en.wikipedia.org/wiki/LINQ	"Language Integrated Query (LINQ, pronounced ""link"") is a Microsoft .NET Framework component that adds native data querying capabilities to .NET languages, originally released as a major part of .NET Framework 3.5 in 2007."				https://docs.microsoft.com/en-us/dotnet/standard/using-linq
lis	https://en.wikipedia.org/wiki/LIS_(programming_language)	LIS (Language d'Implementation de Systèmes) was a system implementation programming language designed by Jean Ichbiah, who later designed Ada.				
lisa	https://en.wikipedia.org/wiki/Language_for_Instruction_Set_Architecture	LISA (Language for Instruction Set Architectures) is a language to describe the instruction set architecture of a processor. LISA captures the information required to generate software tools (compiler, assembler, instruction set simulator, ...) and implementation hardware (in VHDL or Verilog) of a given processor.	2007			http://www.ice.rwth-aachen.de/research/tools-projects/lisa/lisa
language h	https://en.wikipedia.org/wiki/Language_H	"Language H is a proprietary, procedural programming language created by NCR based on COBOL. The first compiler was developed in August 1962 to run on the National-Elliott 405M and produce object code for the National-Elliott 803B.[1] It is believed that the ""H"" stands for John C Harwell.[2]"	1962		['procedural']	
lisp	https://en.wikipedia.org/wiki/Lisp_(programming_language)	Lisp (historically LISP) is a family of programming languages with a long history and a distinctive, fully parenthesized prefix notation.[3] Originally specified in 1958, Lisp is the second-oldest high-level programming language in widespread use today. Only Fortran is older, by one year.[4][5] Lisp has changed since its early days, and many dialects have existed over its history. Today, the best-known general-purpose Lisp dialects are Racket, Common Lisp, Scheme and Clojure.	1958	['Dynamic', 'strong']	['Multi-paradigm', 'functional', 'procedural', 'reflective', 'meta']	
lite-c	https://en.wikipedia.org/wiki/Lite-C	Lite-C is a programming language for multimedia applications and personal computer games, using a syntax subset of the C language with some elements of the C++ language. Its main difference to C is the native implementation of multimedia and computer game related objects like sounds, images, movies, GUI elements, 2D and 3D models, collision detection and rigid body physics. Lite-C executables are compiled instead of interpreted. Lite-C runs on 32-bit and 64-bit Windows XP or Vista operating systems.	2007			http://www.3dgamestudio.de/litec.php
lithe	https://en.wikipedia.org/wiki/Lithe_(programming_language)	Lithe is an experimental programming language created in 1982 by David Sandberg at the University of Washington which allows the programmer to freely choose their own syntax. Lithe combines the ideas of syntax-directed translation and classes in a novel manner that results in a remarkably simple yet powerful language.				
little b	https://en.wikipedia.org/wiki/Little_b_(programming_language)	Little b is a domain-specific programming language, more specifically, a modeling language, designed to build modular mathematical models of biological systems. It was designed and authored by Aneil Mallavarapu. Little b is being developed in the Virtual Cell Program at Harvard Medical School, headed by mathematician Jeremy Gunawardena.	2004	['dynamic', 'strong']	['functional']	https://web.archive.org/web/20051102195348/http://www.littleb.org/
lll	https://en.wikipedia.org/wiki/Ethereum	Ethereum is a decentralized, open-source blockchain featuring smart contract functionality. Ether (ETH) is the native cryptocurrency of the platform. It is the second-largest cryptocurrency by market capitalization, after Bitcoin.[1] Ethereum is the most actively used blockchain.[2][3]	2015			http://ethereum.org/
logo	https://en.wikipedia.org/wiki/Logo_(programming_language)	Logo is an educational programming language, designed in 1967 by Wally Feurzeig, Seymour Papert, and Cynthia Solomon.[1] Logo is not an acronym: the name was coined by Feurzeig while he was at Bolt, Beranek and Newman,[2] and derives from the Greek logos, meaning word or thought.	1967	['dynamic']	['Multi-paradigm', 'functional', 'educational', 'procedural', 'reflective']	
logtalk	https://en.wikipedia.org/wiki/Logtalk	Logtalk is an object-oriented logic programming language that extends and leverages the Prolog language with a feature set suitable for programming in the large.[1] It provides support for encapsulation and data hiding, separation of concerns and enhanced code reuse.[1] Logtalk uses standard Prolog syntax with the addition of a few operators and directives.	1998		['Logic programming', 'object-oriented programming', 'prototype-based programming']	https://logtalk.org/
lotusscript	https://en.wikipedia.org/wiki/LotusScript	LotusScript is an object oriented programming language used by Lotus Notes (since version 4.0) and other IBM Lotus Software products.				
lpc	https://en.wikipedia.org/wiki/LPC_(programming_language)	LPMud, abbreviated LP, is a family of MUD server software. Its first instance, the original LPMud game driver, was developed in 1989 by Lars Pensjö (hence the LP in LPMud).[1][2][3] LPMud was innovative in its separation of the MUD infrastructure into a virtual machine (known as the driver) and a development framework written in the LPC programming language (known as the mudlib).[4]				
lse	https://en.wikipedia.org/wiki/LSE_(programming_language)	LSE (French: Langage symbolique d'enseignement) is a programming language developed at Supélec and Télémécanique from the late 1960s to the mid 1970s.[1][2][3][4]It is similar to BASIC, except with French-language instead of English-language keywords. It was derived from an earlier language called LSD, also developed at Supélec. It is most commonly said to be an acronym for Langage Symbolique d'Enseignement (Symbolic Teaching Language), but other expansions are also known (e.g. Langage de Sup-Élec, or the more cynical).				
lsl	https://en.wikipedia.org/wiki/Linden_Scripting_Language	"Second Life is an online virtual world, developed and owned by the San Francisco-based firm Linden Lab and launched on June 23, 2003. It saw rapid growth for some years and in 2013 it had approximately one million regular users;[1] growth stabilized and by the end of 2017 active user count had declined to ""between 800,000 and 900,000"".[2] In many ways, Second Life is similar to massively multiplayer online role-playing games; nevertheless, Linden Lab is emphatic that their creation is not a game: ""There is no manufactured conflict, no set objective"".[3]"	2003			http://www.secondlife.com/
livecode	https://en.wikipedia.org/wiki/LiveCode	LiveCode (formerly Revolution and MetaCard[3]) is a cross-platform[4] rapid application development runtime system inspired by HyperCard. It features the LiveCode Script (formerly MetaTalk) programming language which belongs to the family of xTalk scripting languages like HyperCard's HyperTalk.[5][6]	2001			http://livecode.org/
livescript	https://en.wikipedia.org/wiki/LiveScript	LiveScript is a functional programming language that compiles to JavaScript. It was created by Jeremy Ashkenas—the creator of CoffeeScript—along with Satoshi Muramaki, George Zahariev, and many others.[2] Not to be confused with JavaScript (for a brief period in the 1990s, LiveScript was the name of JavaScript).[3]	2011	['dynamic', 'weak']	['multi-paradigm', 'functional', 'object-oriented']	http://livescript.net/
lua	https://en.wikipedia.org/wiki/Lua_(programming_language)	Lua (/ˈluːə/ LOO-ə; from Portuguese: lua [ˈlu.(w)ɐ] meaning moon)[a] is a lightweight, high-level, multi-paradigm programming language designed primarily for embedded use in applications.[3] Lua is cross-platform, since the interpreter of compiled bytecode is written in ANSI C,[4] and Lua has a relatively simple C API to embed it into applications.[5]	1993	['Dynamic', 'strong', 'duck']	['Multi-paradigm', 'scripting', 'imperative', 'procedural', 'prototype-based', 'object-oriented', 'functional']	https://www.lua.org/
lucid	https://en.wikipedia.org/wiki/Lucid_(programming_language)	Lucid is a dataflow programming language designed to experiment with non-von Neumann programming models. It was designed by Bill Wadge and Ed Ashcroft and described in the 1985 book Lucid, the Dataflow Programming Language.[1]	1976		['Dataflow']	
lustre	https://en.wikipedia.org/wiki/Lustre_(programming_language)	Lustre is a formally defined, declarative, and synchronous dataflow programming language for programming reactive systems. It began as a research project in the early 1980s. A formal presentation of the language can be found in the 1991 Proceedings of the IEEE.[1] In 1993 it progressed to practical, industrial use in a commercial product as the core language of the industrial environment SCADE, developed by Esterel Technologies. It is now used for critical control software in aircraft,[2] helicopters, and nuclear power plants.				
lyapas	https://en.wikipedia.org/wiki/LYaPAS	Logical Language for the Representation of Synthesis Algorithms (LYaPAS, Russian: ЛЯПАС) is a programming language created by Arkady Zakrevsky in the Soviet Union.	1964	['Dynamic']	['Array', 'functional', 'structured', 'modular']	
lynx	https://en.wikipedia.org/wiki/Lynx_(programming_language)	Lynx is a programming language for large distributed networks, using remote procedure calls. It was developed by the University of Wisconsin–Madison in 1984 for the Charlotte multicomputer operating system.				
m2001	https://en.wikipedia.org/wiki/M2001	M2001 is a modular educational mathematical programming language for developing and presenting mathematical algorithms, from the modern discrete to the classical continuous mathematics. M2001 is built on a semantic framework that is based in category theory and has a syntax similar to that of Pascal or Modula-2.				
m4	https://en.wikipedia.org/wiki/M4_(computer_language)	m4 is a general-purpose macro processor included in most Unix-like operating systems, and is a component of the POSIX standard.	1977		['macro']	
m#	https://en.wikipedia.org/wiki/M_Sharp_(programming_language)	M# (pronounced em sharp) is a code generation tool and a domain-specific language that can be used to create websites and web applications.[1] It can translate entities and page definitions to ASP.NET Web Forms and MVC and C# code which in turn form the user interface and business logic layer of the application. Its main goals are to reduce time of development, increase code quality, and reduce human errors.[2]	2012	['static', 'dynamic']	['multi-paradigm', 'structured', 'object-oriented', 'event-driven', 'procedural', 'meta']	http://www.msharp.co.uk/
machine code	https://en.wikipedia.org/wiki/Machine_code	In computer programming, machine code, consisting of machine language instructions, is a low-level programming language used to directly control a computer's central processing unit (CPU). Each instruction causes the CPU to perform a very specific task, such as a load, a store, a jump, or an arithmetic logic unit (ALU) operation on one or more units of data in the CPU's registers or memory.				
mad	https://en.wikipedia.org/wiki/MAD_(programming_language)	MAD (Michigan Algorithm Decoder) is a programming language and compiler for the IBM 704 and later the IBM 709, IBM 7090, IBM 7040, UNIVAC 1107, UNIVAC 1108, Philco 210-211, and eventually the IBM S/370 mainframe computers. Developed in 1959 at the University of Michigan by Bernard Galler, Bruce Arden and Robert M. Graham, MAD is a variant of the ALGOL language. It was widely used to teach programming at colleges and universities during the 1960s and played a minor role in the development of CTSS, Multics, and the Michigan Terminal System computer operating systems.[1]	1959		['Imperative']	
mad/i	https://en.wikipedia.org/wiki/MAD_(programming_language)	MAD (Michigan Algorithm Decoder) is a programming language and compiler for the IBM 704 and later the IBM 709, IBM 7090, IBM 7040, UNIVAC 1107, UNIVAC 1108, Philco 210-211, and eventually the IBM S/370 mainframe computers. Developed in 1959 at the University of Michigan by Bernard Galler, Bruce Arden and Robert M. Graham, MAD is a variant of the ALGOL language. It was widely used to teach programming at colleges and universities during the 1960s and played a minor role in the development of CTSS, Multics, and the Michigan Terminal System computer operating systems.[1]	1959		['Imperative']	
magik	https://en.wikipedia.org/wiki/Magik_(programming_language)	Magik is an object-oriented programming language that supports multiple inheritance and polymorphism, and it is dynamically typed. It was designed and implemented in 1989 by Arthur Chance of Smallworld Systems Ltd. as part of Smallworld Geographical Information System (GIS). Following Smallworld's acquisition in 2000, Magik is now provided by GE Energy, still as part of its Smallworld technology platform.				
magma	https://en.wikipedia.org/wiki/Magma_computer_algebra_system	Magma is a computer algebra system designed to solve problems in algebra, number theory, geometry and combinatorics. It is named after the algebraic structure magma. It runs on Unix-like operating systems, as well as Windows.				http://magma.maths.usyd.edu.au/
máni	https://en.wikipedia.org/wiki/M%C3%A1ni	"Máni (Old Norse ""Moon""[1]) is the Moon personified in Germanic mythology. Máni, personified, is attested in the Poetic Edda, compiled in the 13th century from earlier traditional sources, and the Prose Edda, written in the 13th century by Snorri Sturluson. Both sources state that he is the brother of the personified sun, Sól, and the son of Mundilfari, while the Prose Edda adds that he is followed by the children Hjúki and Bil through the heavens. As a proper noun, Máni appears throughout Old Norse literature. Scholars have proposed theories about Máni's potential connection to the Northern European notion of the Man in the Moon, and a potentially otherwise unattested story regarding Máni through skaldic kennings."				
maple	https://en.wikipedia.org/wiki/Maple_(software)	Maple is a symbolic and numeric computing environment as well as a multi-paradigm programming language. It covers several areas of technical computing, such as symbolic mathematics, numerical analysis, data processing, visualization, and others. A toolbox, MapleSim, adds functionality for multidomain physical modeling and code generation.	1982			https://www.maplesoft.com/products/Maple/
mapper	https://en.wikipedia.org/wiki/MAPPER	MAPPER, now known as BIS, is a fourth-generation programming language from Sperry Univac. Mapper originated in the 1970s[1] based on some work in the 1960s,[2] but has been kept current. It was renamed and also given an extension named ICE - Internet Commerce Enabler.[3][1]				
mark-iv	https://en.wikipedia.org/wiki/MARK_IV_(software)	"MARK IV is a fourth-generation programming language that was created by Informatics, Inc. in the 1960s. Informatics took advantage of IBM's decision to unbundle their software; MARK IV was the first ""software product to have cumulative sales of $10 million""."				
mary	https://en.wikipedia.org/wiki/Mary_(programming_language)	Mary is a programming language designed and implemented by RUNIT at Trondheim, Norway in the 1970s. It borrowed many features from ALGOL 68 but was designed for systems programming (machine-oriented programming).	1971	['static', 'strong']	['imperative']	
matlab	https://en.wikipedia.org/wiki/MATLAB	"MATLAB (an abbreviation of ""matrix laboratory"") is a proprietary multi-paradigm programming language and numeric computing environment developed by MathWorks. MATLAB allows matrix manipulations, plotting of functions and data, implementation of algorithms, creation of user interfaces, and interfacing with programs written in other languages."	1970	['dynamic', 'weak']	['multi-paradigm', 'functional', 'imperative', 'procedural', 'object-oriented', 'array']	https://www.mathworks.com/products/matlab.html
masm microsoft assembly x86	https://en.wikipedia.org/wiki/Microsoft_Macro_Assembler	The Microsoft Macro Assembler (MASM) is an x86 assembler that uses the Intel syntax for MS-DOS and Microsoft Windows. Beginning with MASM 8.0, there are two versions of the assembler: One for 16-bit & 32-bit assembly sources, and another (ML64) for 64-bit sources only.	1981			https://docs.microsoft.com/en-us/cpp/assembler/masm/microsoft-macro-assembler-reference
math-matic	https://en.wikipedia.org/wiki/MATH-MATIC	MATH-MATIC is the marketing name for the AT-3 (Algebraic Translator 3) compiler, an early programming language for the UNIVAC I and UNIVAC II.	1957		['imperative']	
maude system	https://en.wikipedia.org/wiki/Maude_system	The Maude system is an implementation of rewriting logic developed at SRI International. It is similar in its general approach to Joseph Goguen's OBJ3 implementation of equational logic, but based on rewriting logic rather than order-sorted equational logic, and with a heavy emphasis on powerful metaprogramming based on reflection.				
maxima	https://en.wikipedia.org/wiki/Maxima_(software)	Maxima (/ˈmæksɪmə/) is a computer algebra system (CAS) based on a 1982 version of Macsyma. It is written in Common Lisp and runs on all POSIX platforms such as macOS, Unix, BSD, and Linux, as well as under Microsoft Windows and Android. It is free software released under the terms of the GNU General Public License (GPL).	1982			https://maxima.sourceforge.io/
macsyma	https://en.wikipedia.org/wiki/Macsyma	"Macsyma (/ˈmæksɪmə/; ""Project MAC's SYmbolic MAnipulator"")[1] is one of the oldest general-purpose computer algebra systems still in wide use. It was originally developed from 1968 to 1982 at MIT's Project MAC."				
max	https://en.wikipedia.org/wiki/Max_(software)	Max, also known as Max/MSP/Jitter, is a visual programming language for music and multimedia developed and maintained by San Francisco-based software company Cycling '74. Over its more than thirty-year history, it has been used by composers, performers, software designers, researchers, and artists to create recordings, performances, and installations.[1]				https://cycling74.com/products/max/
maxscript	https://en.wikipedia.org/wiki/Autodesk_3ds_Max	Autodesk 3ds Max, formerly 3D Studio and 3D Studio Max, is a professional 3D computer graphics program for making 3D animations, models, games and images. It is developed and produced by Autodesk Media and Entertainment.[2] It has modeling capabilities and a flexible plugin architecture and must be used on the Microsoft Windows platform. It is frequently used by video game developers, many TV commercial studios, and architectural visualization studios. It is also used for movie effects and movie pre-visualization. For its modeling and animation tools, the latest version[which?] of 3ds Max also features shaders (such as ambient occlusion and subsurface scattering), dynamic simulation, particle systems, radiosity, normal map creation and rendering, global illumination, a customizable user interface, new icons, and its own scripting language.[3]	1996			https://www.autodesk.com/products/3ds-max/overview
maya	https://en.wikipedia.org/wiki/Maya_Embedded_Language	The Maya Embedded Language (MEL) is a scripting language used to simplify tasks in Autodesk's 3D Graphics Software Maya. Most tasks that can be achieved through Maya's GUI can be achieved with MEL, as well as certain tasks that are not available from the GUI. MEL offers a method of speeding up complicated or repetitive tasks, as well as allowing users to redistribute a specific set of commands to others that may find it useful.				
mdl	https://en.wikipedia.org/wiki/MDL_(programming_language)	MDL (Model Development Language,[1] or colloquially also referred to as More Datatypes than Lisp[2]:3 or MIT Design Language[citation needed]) is a programming language, a descendant of the language Lisp. Its initial purpose was to provide high level language support for the Dynamic Modeling Group at Massachusetts Institute of Technology's (MIT) Project MAC.[3] It was initially developed in 1971 on a PDP-10 computer on a time-sharing operating system named Incompatible Timesharing System (ITS). It later ran on TENEX, TOPS-20,[4][5] BSD,[2]:6 and AEGIS.[6]	1971	['Dynamic', 'strong']	['Multi-paradigm', 'functional', 'procedural', 'reflective', 'meta']	
mercury	https://en.wikipedia.org/wiki/Mercury_(programming_language)	Mercury is a functional logic programming language made for real-world uses. The first version was developed at the University of Melbourne, Computer Science department, by Fergus Henderson, Thomas Conway, and Zoltan Somogyi, under Somogyi's supervision, and released on April 8, 1995.	1995	['Strong', 'static', 'polymorphic']	['Logic', 'functional', 'object-oriented']	http://www.mercurylang.org/
mesa	https://en.wikipedia.org/wiki/Mesa_(programming_language)	"Mesa[1] is a programming language developed in the late 1970s at the Xerox Palo Alto Research Center in Palo Alto, California, United States. The language name was a pun based upon the programming language catchphrases of the time, because Mesa is a ""high level"" programming language."	1976			
mheg-5	https://en.wikipedia.org/wiki/MHEG-5	MHEG-5, or ISO/IEC 13522-5,[1] is part of a set of international standards relating to the presentation of multimedia information, standardised by the Multimedia and Hypermedia Experts Group (MHEG). It is most commonly used as a language to describe interactive television services.				
microcode	https://en.wikipedia.org/wiki/Microassembler	A microassembler is a computer program that helps prepare a microprogram, called firmware, to control the low level operation of a computer in much the same way an assembler helps prepare higher level code for a processor. The difference is that the microprogram is usually only developed by the processor manufacturer and works intimately with the computer hardware. On a microprogrammed computer the microprogram implements the operations of the instruction set in which any normal program (including both application programs and operating systems) is written. The use of a microprogram allows the manufacturer to fix certain mistakes, including working around hardware design errors, without modifying the hardware. Another means of employing microassembler-generated microprograms is in allowing the same hardware to run different instruction sets. After it is assembled, the microprogram is then loaded to a control store to become part of the logic of a CPU's control unit.				
microscript	https://en.wikipedia.org/wiki/MicroScript_(programming_language)	"TRON (acronym for ""The Real-time Operating system Nucleus"") is an open architecture real-time operating system kernel design. The project was started by Prof. Dr. Ken Sakamura of the University of Tokyo in 1984. The project's goal is to create an ideal computer architecture and network, to provide for all of society's needs.[1]"				
miis	https://en.wikipedia.org/wiki/MIIS_(programming_language)	MIIS (Meditech Interpretive Information System) is a MUMPS-like programming language that was created by A.Neil Pappalardo and Curt W. Marble, on a DEC PDP at Mass General Hospital from 1964 to 1968. MUMPS evolution took two major directions: MUMPS proper and MIIS. MUMPS became an ANSI and ISO-standard language. When many MUMPS implementations standardized to be compatible, MIIS did not standardize, but became a proprietary system instead.				
milk	https://en.wikipedia.org/wiki/Milk_(programming_language)	"Milk is a programming language ""that lets application developers manage memory more efficiently in programs that deal with scattered data points in large data sets.""[1]"				
mimic	https://en.wikipedia.org/wiki/MIMIC	MIMIC, known in capitalized form only, is a former simulation computer language developed 1964 by H. E. Petersen, F. J. Sansom and L. M. Warshawsky of Systems Engineering Group within the Air Force Materiel Command at the Wright-Patterson AFB in Dayton, Ohio, United States.[1] It is an expression-oriented continuous block simulation language, but capable of incorporating blocks of FORTRAN-like algebra.				
mirah	https://en.wikipedia.org/wiki/Mirah_(programming_language)	"Mirah (formerly Duby) is a programming language based on Ruby language syntax, local type inference, hybrid static–dynamic type system, and a pluggable compiler toolchain. Mirah was created by Charles Oliver Nutter to be ""a 'Ruby-like' language, probably a subset of Ruby syntax, that [could] compile to solid, fast, idiomatic JVM bytecode.""[1] The word mirah refers to the gemstone ruby in the Javanese language, a play on the concept of Ruby in Java.[2]"		['static, with dynamic features', 'strong', 'inferred']	['Object-oriented', 'imperative']	http://www.mirah.org/
