name	source	about	first_release	types	paradigms	website
plex	https://en.wikipedia.org/wiki/PLEX_(programming_language)	"PLEX (Programming Language for EXchanges) is a special-purpose, concurrent, real-time programming language. The proprietary PLEX language is closely tied to the architecture of Ericsson's AXE telephone exchanges which it was designed to control. PLEX was developed by Göran Hemdahl at Ericsson in the 1970s,[1] and it has been continuously evolving since then.[2] PLEX was described in 2008 as ""a cross between Fortran and a macro assembler.""[3]"	1970		['procedural', 'imperative']	
plexil	https://en.wikipedia.org/wiki/PLEXIL	PLEXIL (Plan Execution Interchange Language) is an open source technology for automation, created and currently in development by NASA.	2005	['Static', 'unsafe', 'nominative']	['Multi-paradigm']	http://plexil.sourceforge.net/
plus	https://en.wikipedia.org/wiki/Plus_(programming_language)	"Plus is a ""Pascal-like"" system implementation language from the University of British Columbia (UBC), Canada, based on the SUE[1] system language developed at the University of Toronto, c. 1971.[2]"	1976	['static', 'strong', 'safe']	['imperative', 'structured']	
pop-11	https://en.wikipedia.org/wiki/POP-11	POP-11 is a reflective, incrementally compiled programming language with many of the features of an interpreted language. It is the core language of the Poplog programming environment developed originally by the University of Sussex, and recently in the School of Computer Science at the University of Birmingham, which hosts the main Poplog website. Core source files are also available on GitHub.				
pop-2	https://en.wikipedia.org/wiki/POP-2	POP-2 (also referred to as POP2) is a programming language developed around 1970 from the earlier language POP-1 (developed by Robin Popplestone in 1968, originally named COWSEL) by Robin Popplestone and Rod Burstall at the University of Edinburgh. It drew roots from many sources: the languages LISP and ALGOL 60, and theoretical ideas from Peter J. Landin. It used an incremental compiler, which gave it some of the flexibility of an interpreted language, including allowing new function definitions at run time and modification of function definitions while a program was running (both of which are features of dynamic compilation), without the overhead of an interpreted language.[1]				
postscript	https://en.wikipedia.org/wiki/PostScript	PostScript (PS) is a page description language in the electronic publishing and desktop publishing business. It is a dynamically typed, concatenative programming language. It was created at Adobe Systems by John Warnock, Charles Geschke, Doug Brotz, Ed Taft and Bill Paxton from 1982 to 1984.	1982		['Multi-paradigm', 'stack-based', 'procedural']	
portable	https://en.wikipedia.org/wiki/Amiga_E	Amiga E, or very often simply E, is a programming language created by Wouter van Oortmerssen on the Amiga. He has since moved on to develop the SHEEP programming language for the new AmigaDE platform and the CryScript language (also known as DOG) used during the development of the video game Far Cry.				
pov-ray sdl	https://en.wikipedia.org/wiki/POV-Ray	The Persistence of Vision Ray Tracer, most commonly acronymed as POV-Ray, is a cross-platform ray-tracing program that generates images from a text-based scene description. It was originally based on DKBTrace, written by David Kirk Buck and Aaron A. Collins for Amiga computers. There are also influences from the earlier Polyray[6] raytracer because of contributions from its author, Alexander Enzmann. POV-Ray is free and open-source software, with the source code available under the AGPLv3.	1991			http://www.povray.org/
powerhouse	https://en.wikipedia.org/wiki/Powerhouse_(programming_language)	PowerHouse is a trademarked name for a byte-compiled fourth-generation programming language (or 4GL) originally produced by Quasar Corporation (later renamed Cognos Incorporated) for the Hewlett-Packard HP3000 mini-computer, as well as Data General and DEC VAX VMS computing products. It was initially composed of five components:				https://teamblue.unicomsi.com/products/powerhouse-4gl/
powerbuilder	https://en.wikipedia.org/wiki/PowerBuilder	PowerBuilder is an integrated development environment owned by SAP since the acquisition of Sybase in 2010. On July 5, 2016, SAP and Appeon entered into an agreement whereby Appeon would be responsible for developing, selling, and supporting PowerBuilder.[1]	1992			http://www.appeon.com/
powershell	https://en.wikipedia.org/wiki/PowerShell	PowerShell is a task automation and configuration management framework from Microsoft, consisting of a command-line shell and the associated scripting language. Initially a Windows component only, known as Windows PowerShell, it was made open-source and cross-platform on 18 August 2016 with the introduction of PowerShell Core.[5] The former is built on the .NET Framework, the latter on .NET Core.	2006	['Strong', 'safe', 'implicit', 'dynamic']	['Imperative', 'pipeline', 'object-oriented', 'functional', 'reflective']	https://microsoft.com/powershell
ppl	https://en.wikipedia.org/wiki/Polymorphic_Programming_Language	The Polymorphic Programming Language (PPL) was developed in 1969 at Harvard University by Thomas A. Standish. It is an interactive, extensible language with a base language similar to the language APL.[1]				
processing	https://en.wikipedia.org/wiki/Processing_(programming_language)	Processing is a free graphical library and integrated development environment (IDE) built for the electronic arts, new media art, and visual design communities with the purpose of teaching non-programmers the fundamentals of computer programming in a visual context.	2001		['Object-oriented']	http://processing.org/
processing.js	https://en.wikipedia.org/wiki/Processing.js	Processing.js is a JavaScript port of Processing, a programming language designed to write visualisations, images, and interactive content. It allows web browsers to display animations, visual applications, games and other graphical rich content without the need for a Java applet or Flash plugin.	2008			http://processingjs.org/
prograph	https://en.wikipedia.org/wiki/Prograph	Prograph is a visual, object-oriented, dataflow, multiparadigm programming language that uses iconic symbols to represent actions to be taken on data. Commercial Prograph software development environments such as Prograph Classic and Prograph CPX were available for the Apple Macintosh and Windows platforms for many years but were eventually withdrawn from the market in the late 1990s. Support for the Prograph language on macOS has recently reappeared with the release of the Marten software development environment.[1]	1983		['multi-paradigm', 'object-oriented', 'visual', 'dataflow']	
proiv	https://en.wikipedia.org/wiki/PROIV	PROIV (/proʊ,fʊər/) is a low code development platform, developed and sold by NorthgateArinso, part of the Northgate Information Solutions Group. It has an active community of around 2500 developers and end-users worldwide, ranging from consultants to large multinationals, finance institutions, tax authorities, retailers, engineering companies, media operators and software houses.				
project verona	https://en.wikipedia.org/wiki/Project_Verona	Project Verona is an experimental research programming language developed by Microsoft and aimed at dealing with memory situations to make other programming languages safer.[2][1]	2019			https://www.microsoft.com/en-us/research/project/project-verona
prolog	https://en.wikipedia.org/wiki/Prolog	Prolog is a logic programming language associated with artificial intelligence and computational linguistics.[1][2][3]	1972		['Logic programming']	https://www.iso.org/standard/21413.html
promal	https://en.wikipedia.org/wiki/PROMAL	PROMAL (PROgrammer's Microapplication Language) is a structured programming language from Systems Management Associates for MS-DOS, Commodore 64, and Apple II. PROMAL features simple syntax, no line numbers, long variable names, functions and procedures with argument passing, real number type, arrays, strings, pointer, and a built-in I/O library. Like ABC and Python, indentation is part of the language syntax.	1984		['Imperative', 'procedural', 'structured']	
promela	https://en.wikipedia.org/wiki/Promela	PROMELA (Process or Protocol Meta Language) is a verification modeling language introduced by Gerard J. Holzmann. The language allows for the dynamic creation of concurrent processes to model, for example, distributed systems. In PROMELA models, communication via message channels can be defined to be synchronous (i.e., rendezvous), or asynchronous (i.e., buffered). PROMELA models can be analyzed with the SPIN model checker, to verify that the modeled system produces the desired behavior. An implementation verified with Isabelle/HOL is also available, as part of the Computer Aided Verification of Automata project.[1] Files written in Promela traditionally have a .pml file extension.				
prose modeling language	https://en.wikipedia.org/wiki/PROSE_modeling_language	Author Joseph Thames, now deceased (2019), has left us with his latest version of PROSE, called FortranCalculus. It is freeware that can be downloaded from https://goal-driven.net/apps/fc-compiler.html . Joe's www.metacalculus.com website is no longer up. I worked with Joe since ~1975, he will be missed! Thanks, Phil B Brubaker. [1]				
protel	https://en.wikipedia.org/wiki/Protel	"Protel stands for ""Procedure Oriented Type Enforcing Language"". It is a programming language created by Nortel Networks and used on telecommunications switching systems such as the DMS-100.[1][2] Protel-2 is the object-oriented version of Protel.[3][4]"				
providex	https://en.wikipedia.org/wiki/ProvideX	ProvideX is a computer language and development environment derived from Business Basic (a business oriented derivative of BASIC) in the mid-1980s.	1992			http://www.pvxplus.com/
pro*c	https://en.wikipedia.org/wiki/Pro*C	Pro*C (also known as Pro*C/C++) is an embedded SQL programming language used by Oracle Database DBMSes. Pro*C uses either C or C++ as its host language. During compilation, the embedded SQL statements are interpreted by a precompiler and replaced by C or C++ function calls to their respective SQL library. The output from the Pro*C precompiler is standard C or C++ code that is then compiled by any one of several C or C++ compilers into an executable.				
pure	https://en.wikipedia.org/wiki/Pure_(programming_language)	Pure, successor to the equational language Q, is a dynamically typed, functional programming language based on term rewriting. It has facilities for user-defined operator syntax, macros, arbitrary-precision arithmetic (multiple-precision numbers), and compiling to native code through the LLVM. Pure is free and open-source software distributed (mostly) under the GNU Lesser General Public License version 3 or later.	2008	['Strong', 'dynamic']	['Functional', 'declarative', 'term rewriting']	https://agraef.github.io/pure-lang/
pure data	https://en.wikipedia.org/wiki/Pure_Data	Pure Data (Pd) is a visual programming language developed by Miller Puckette in the 1990s for creating interactive computer music and multimedia works. While Puckette is the main author of the program, Pd is an open-source project with a large developer base working on new extensions. It is released under a license similar to the BSD license. It runs on Linux, Mac OS X, iOS, Android and Windows. Ports exist for FreeBSD and IRIX.				http://puredata.info/
purescript	https://en.wikipedia.org/wiki/PureScript	PureScript is a strongly-typed, purely-functional programming language that compiles to JavaScript. It can be used to develop web applications, server side apps, and also desktop applications with use of Electron. Its syntax is mostly comparable to that of Haskell. In addition, it introduces row polymorphism and extensible records.[2] Also, contrary to Haskell, PureScript adheres to a strict evaluation strategy.	2013	['Inferred', 'static', 'strong']	['Functional']	http://www.purescript.org/
python	https://en.wikipedia.org/wiki/Python_(programming_language)	Python is an interpreted, high-level and general-purpose programming language. Python's design philosophy emphasizes code readability with its notable use of significant indentation. Its language constructs and object-oriented approach aim to help programmers write clear, logical code for small and large-scale projects.[29]	1991	['Duck', 'dynamic', 'strong typing', '[4]', 'gradual', 'CPython', '[5]']	['Multi-paradigm', 'functional', 'imperative', 'object-oriented', 'structured', 'reflective']	https://www.python.org/
q	https://en.wikipedia.org/wiki/Q_(programming_language_from_Kx_Systems)	Q is a programming language for array processing, developed by Arthur Whitney. It is proprietary software, commercialized by Kx Systems. Q serves as the query language for kdb+, a disk based and in-memory, column-based database. Kdb+ is based on the language k, a terse variant of the language APL. Q is a thin wrapper around k, providing a more readable, English-like interface.[3]	2003	['Dynamic', 'strong']	['Array', 'functional']	http://code.kx.com/
q#	https://en.wikipedia.org/wiki/Q_Sharp	Q# (pronounced as Q sharp) is a domain-specific programming language used for expressing quantum algorithms.[1] It was initially released to the public by Microsoft as part of the Quantum Development Kit.[2]	2017	['static', 'strong']	['multi-paradigm', 'quantum', 'functional', 'imperative']	https://docs.microsoft.com/en-us/quantum
qalb	https://en.wikipedia.org/wiki/Qalb_(programming_language)	قلب (Levantine Arabic: [ʔalb]), transliterated Qalb, Qlb and Alb, is a functional programming language allowing a programmer to write programs completely in Arabic.[1] Its name means heart and is a recursive acronym in Arabic meaning Qlb: a programming language (قلب: لغة برمجة, Qlb: Lughat Barmajah). It was developed in 2012 by Ramsey Nasser, a computer scientist at the Eyebeam Art + Technology Center in New York City, as both an artistic endeavor and as a response to the Anglophone bias in the vast majority of programming languages, which express their fundamental concepts using English words.	2012		['Functional']	http://qlb-repl.herokuapp.com/
quantum computation language	https://en.wikipedia.org/wiki/Quantum_Computation_Language	Quantum Computation Language (QCL) is one of the first implemented quantum programming languages.[1] The most important feature of QCL is the support for user-defined operators and functions. Its syntax resembles the syntax of the C programming language and its classical data types are similar to primitive data types in C. One can combine classical code and quantum code in the same program.				
qtscript	https://en.wikipedia.org/wiki/QtScript	QtScript is a scripting engine that has been part of the Qt cross-platform application framework since version 4.3.0.				
quakec	https://en.wikipedia.org/wiki/QuakeC	QuakeC is a compiled language developed in 1996 by John Carmack of id Software to program parts of the video game Quake. Using QuakeC, a programmer is able to customize Quake to great extents by adding weapons, changing game logic and physics, and programming complex scenarios. It can be used to control many aspects of the game itself, such as parts of the AI, triggers, or changes in the level. The Quake engine was the only game engine to use QuakeC. Following engines used DLL game modules for customization written in C, and C++ from id Tech 4 on.	1996	['static', 'strong']	['imperative', 'procedural', 'structured']	
qpl	https://en.wikipedia.org/wiki/Quantum_programming	Quantum programming is the process of assembling sequences of instructions, called quantum programs, that are capable of running on a quantum computer. Quantum programming languages help express quantum algorithms using high-level constructs.[1]				
.ql	https://en.wikipedia.org/wiki/.QL	".QL (pronounced ""dot-cue-el"") is an object-oriented query language used to retrieve data from relational database management systems. It is reminiscent of the standard query language SQL and the object-oriented programming language Java. .QL is an object-oriented variant of a logical query language called Datalog. Hierarchical data can therefore be naturally queried in .QL in a recursive manner."	2007	['static', 'strong']	['multi-paradigm', 'logic-paradigm', 'object-oriented-paradigm']	
r	https://en.wikipedia.org/wiki/R_(programming_language)	R is a programming language and free software environment for statistical computing and graphics supported by the R Foundation for Statistical Computing.[6] The R language is widely used among statisticians and data miners for developing statistical software[7] and data analysis.[8] Polls, data mining surveys, and studies of scholarly literature databases show substantial increases in popularity;[9] as of January 2021, R ranks 9th in the TIOBE index, a measure of popularity of programming languages.[10]	1993	['Dynamic']	['Multi-paradigm', 'Array', 'object-oriented', 'imperative', 'functional', 'procedural', 'reflective']	https://www.r-project.org/
r++	https://en.wikipedia.org/wiki/R%2B%2B	R++ is a rule-based programming language based on C++. The United States patent describes R++ as follows:				
racket	https://en.wikipedia.org/wiki/Racket_(programming_language)	Racket is a general-purpose, multi-paradigm programming language based on the Scheme dialect of Lisp. It is designed to be a platform for programming language design and implementation.[9] In addition to the core Racket language, Racket is also used to refer to the family of programming languages[10] and set of tools supporting development on and with Racket.[11] Racket is also used for scripting, computer science education, and research.	1995	['Dynamic', 'static', 'strong']	['Multi-paradigm', 'functional', 'imperative', 'logic', 'meta', 'modular', 'object-oriented', 'reflective']	https://racket-lang.org/
raku	https://en.wikipedia.org/wiki/Raku_(programming_language)	Raku is a member of the Perl family of programming languages.[6] Formerly known as Perl 6, it was renamed in October 2019.[7][8] Raku introduces elements of many modern and historical languages. Compatibility with Perl was not a goal, though a compatibility mode is part of the specification. The design process for Raku began in 2000.	2015	['Dynamic', 'gradual']	['Multi-paradigm']	http://raku.org/
rapid	https://en.wikipedia.org/wiki/RAPID	RAPID is a high-level programming language used to control ABB industrial robots. RAPID was introduced along with S4 Control System in 1994 by ABB, superseding the ARLA programming language.	1994			
rapira	https://en.wikipedia.org/wiki/Rapira	Rapira (Russian: Рапира, rapier) is an educational procedural programming language developed in the Soviet Union and implemented on Agat computer, PDP-11 clones (Electronika, DVK, BK series) and Intel-8080/Z80 clones (Korvet). It was an interpreted language with dynamic type system and high level constructions. The language originally had a Russian-based set of keywords, but English and Romanian were added later. Also, it was more elegant and easier to use than existing Pascal implementations of the time[according to whom?].				
ratfiv	https://en.wikipedia.org/wiki/Ratfiv	"Ratfiv is an enhanced version of the Ratfor programming language, a preprocessor for Fortran designed to give it C-like capabilities. Fortran was widely used for scientific programming but had very basic control-flow primitives (""do"" and ""goto"") and no ""macro"" facility which limited its expressiveness."				
ratfor	https://en.wikipedia.org/wiki/Ratfor	Ratfor (short for Rational Fortran) is a programming language implemented as a preprocessor for Fortran 66. It provides modern control structures, unavailable in Fortran 66, to replace GOTOs and statement numbers.	1976			http://sepwww.stanford.edu/doku.php?id=sep:software:ratfor
rc	https://en.wikipedia.org/wiki/Rc	"rc (for ""run commands"") is the command line interpreter for Version 10 Unix and Plan 9 from Bell Labs operating systems. It resembles the Bourne shell, but its syntax is somewhat simpler. It was created by Tom Duff, who is better known for an unusual C programming language construct (""Duff's device"").[1]"	1989	['weak']	['imperative', 'pipeline']	http://doc.cat-v.org/plan_9/4th_edition/papers/rc
reason	https://en.wikipedia.org/wiki/Reason_(programming_language)	Reason, also known as ReasonML, is a syntax extension and toolchain for OCaml created by Jordan Walke, who also created React, at Facebook.[2] Reason offers a syntax familiar to JavaScript programmers, and transpiles to OCaml.[3] Statically typed Reason (or OCaml) code may be compiled to dynamically typed JavaScript using the ReScript compiler.[4]	2016			https://reasonml.github.io/
rebol	https://en.wikipedia.org/wiki/REBOL	Rebol (/ˈrɛbəl/ REB-əl; historically REBOL) is a cross-platform[6] data exchange language and a multi-paradigm dynamic programming language designed by Carl Sassenrath for network communications and distributed computing. It introduces the concept of dialecting: small, optimized, domain-specific languages for code and data,[6][7] which is also the most notable property of the language according to its designer Carl Sassenrath:	1997	['dynamic', 'strong']	['language oriented programming', 'data exchange', 'functional', 'prototype-based', 'imperative']	http://www.rebol.com/
red	https://en.wikipedia.org/wiki/Red_(programming_language)	Red is a programming language designed to overcome the limitations of the programming language Rebol. Red was introduced in 2011 by Nenad Rakočević, and is both an imperative and functional programming language. Its syntax and general usage overlaps that of the interpreted Rebol language.	2011		['imperative', 'functional', 'symbolic']	https://www.red-lang.org/
redcode	https://en.wikipedia.org/wiki/Core_War	"Core War is a 1984 programming game created by D. G. Jones and A. K. Dewdney in which two or more battle programs (called ""warriors"") compete for control of a virtual computer. These battle programs are written in an abstract assembly language called Redcode."				
refal	https://en.wikipedia.org/wiki/REFAL	"Refal (""Recursive functions algorithmic language""; Russian: РЕФАЛ) ""is a functional programming language oriented toward symbolic computations"", including ""string processing, language translation, [and] artificial intelligence"".[1] It is one of the oldest members of this family, first conceived of in 1966 as a theoretical tool, with the first implementation appearing in 1968. Refal was intended to combine mathematical simplicity with practicality for writing large and sophisticated programs."	1968	['strong', 'dynamic']	['Pattern-matching', 'term-rewriting']	http://www.refal.net/
rexx	https://en.wikipedia.org/wiki/REXX	Rexx (Restructured Extended Executor) is an interpreted programming language developed at IBM by Mike Cowlishaw.[2][3] It is a structured, high-level programming language designed for ease of learning and reading. Proprietary and open source Rexx interpreters exist for a wide range of computing platforms; compilers exist for IBM mainframe computers.[4]	1979		['multiparadigm', 'procedural', 'structured']	
rlab	https://en.wikipedia.org/wiki/Rlab	Rlab is an interactive, interpreted numerical computation program and its core programming language, written by Ian Searle. Rlab (the language) is very high level and is intended to provide fast prototyping and program development, as well as easy data-visualization, and processing.				
rockstar	https://codewithrockstar.com/					
roop	https://en.wikipedia.org/wiki/ROOP_(programming_language)	ROOP is a multiparadigm programming language targeted at AI applications created at the Chengdu University of China. It combines rule-based, procedural, logical and object-oriented programming techniques.				
rpg	https://en.wikipedia.org/wiki/IBM_RPG	RPG is a modern proprietary high-level programming language (HLL) for business applications, popular on the IBM i operating system on IBM Power Systems hardware. The current version, RPG IV, a.k.a. ILE RPG, provides a modern programming environment. IBM has evolved the language, providing new capabilities, to take advantage of technologies that have grown up in the marketplace.	1959	['Strong', 'static']	['Multi-paradigm']	
rpl	https://en.wikipedia.org/wiki/RPL_(programming_language)	RPL[1] is a handheld calculator operating system and application programming language used on Hewlett-Packard's scientific graphing RPN (Reverse Polish Notation) calculators of the HP 28, 48, 49 and 50 series, but it is also usable on non-RPN calculators, such as the 38, 39 and 40 series.	1986		['stack', 'structured', 'object-oriented']	
rsl	https://en.wikipedia.org/wiki/Robot_Battle	Robot Battle is a programming game for Microsoft Windows where players design and code adaptable battling robots. Robot Battle takes strategy rather than reflexes, accuracy, or timing to succeed. What differentiates one robot from the next is its programming, for which the player is responsible. The game is inspired by the similar game RobotWar.				
rtl/2	https://en.wikipedia.org/wiki/RTL/2	RTL/2 (Real-Time Language) is a discontinued high-level programming language for use in real-time computing, developed at Imperial Chemical Industries, Ltd. (ICI), by J.G.P. Barnes. It was originally used internally in ICI but was distributed by SPL International in 1974.[1] It was based on concepts from ALGOL 68, and intended to be small and simple.[2][3][4] RTL/2 was standardised in 1980 by the British Standards Institution.[5]	1972	['static', 'strong', 'safe', 'structural']	['Multi-paradigm', 'imperative', 'structured', 'real-time']	
