name	source	about	first_release	types	paradigms	website
a.net	https://en.wikipedia.org/wiki/A_Sharp_(.NET)	A# is a port of the Ada programming language to the Microsoft .NET platform. A# is freely distributed by the Department of Computer Science at the United States Air Force Academy as a service to the Ada community under the terms of the GNU General Public License.	2004			http://www.asharp.martincarlisle.com/
a-0 system	https://en.wikipedia.org/wiki/A-0_System	The A-0 system (Arithmetic Language version 0), written by Grace Murray Hopper [1] in 1951 and 1952 for the UNIVAC I, was an early[2] compiler related tool developed for electronic computers.[3] The A-0 functioned more as a loader or linker than the modern notion of a compiler. A program was specified as a sequence of subroutines and arguments. The subroutines were identified by a numeric code and the arguments to the subroutines were written directly after each subroutine code. The A-0 system converted the specification into machine code that could be fed into the computer a second time to execute the said program.				
a+	https://en.wikipedia.org/wiki/A%2B_(programming_language)	A+ is an array programming language descended from the programming language A, which in turn was created to replace APL in 1988.[2] Arthur Whitney developed the A portion of A+, while other developers at Morgan Stanley extended it, adding a graphical user interface and other language features. A+ is a high-level, interactive, interpreted language, designed for numerically intensive applications, especially those found in financial applications. A+ runs on many Unix variants, including Linux. It is free and open source software released under a GNU General Public License.	1988	['Dynamic', 'strong']	['Array']	http://www.aplusdev.org/
abap	https://en.wikipedia.org/wiki/ABAP	"ABAP (Advanced Business Application Programming, originally Allgemeiner Berichts-Aufbereitungs-Prozessor, German for ""general report creation processor""[3]) is a high-level programming language created by the German software company SAP SE. It is extracted from the base computing languages Java, C, C++ and Python. It is currently positioned, alongside Java, as the language for programming the SAP NetWeaver Application Server, which is part of the SAP NetWeaver platform for building business applications."	1983	['Static', 'strong', 'safe', 'nominative']	['Object-oriented', 'structured', 'imperative']	http://scn.sap.com/community/abap
abc	https://en.wikipedia.org/wiki/ABC_(programming_language)	ABC is an imperative general-purpose programming language and integrated development environment (IDE) developed at Centrum Wiskunde & Informatica (CWI), Netherlands by Leo Geurts, Lambert Meertens, and Steven Pemberton. It is interactive, structured, high-level, and intended to be used instead of BASIC, Pascal, or AWK. It is intended for teaching or prototyping, but not as a systems-programming language.	1987	['strong', 'polymorphic']	['multi-paradigm', 'imperative', 'procedural', 'structured']	https://homepages.cwi.nl/~steven/abc/
abc algol	https://en.wikipedia.org/wiki/ABC_ALGOL	ABC ALGOL is an extension of the programming language ALGOL 60 with arbitrary data structures and user-defined operators, intended for computer algebra (symbolic mathematics). Despite its advances, it was never used as widely as Algol proper.				
acc	https://en.wikipedia.org/wiki/ACC_(programming_language)	ACC is a near-C compiler for the MS-DOS operating system on the IBM PC line of computers for programs.[1] The compiler and compiled programs will run on any Intel 80386 or above PC running MS-DOS. Included with the compiler are a 386 assembler and a linker for combining multiple object files.[2] There are also two libraries, which are a protected mode DOS extender (based on Thomas Pytel's, AKA Tran's PMODE30B + PMODE307 DOS extenders), and a library of functions callable by C programs.				
accent	https://en.wikipedia.org/wiki/Accent_(programming_language)	Rational Synergy is a software tool that provides software configuration management (SCM) capabilities for all artifacts related to software development including source code, documents and images as well as the final built software executable and libraries. Rational Synergy also provides the repository for the change management tool known as Rational Change. Together these two tools form an integrated configuration management and change management environment that is used in software development organizations that need controlled SCM processes and an understanding of what is in a build of their software.	1990			http://www.ibm.com/software/products/en/ratisyne
ace dasl	https://en.wikipedia.org/wiki/Distributed_Application_Specification_Language	The DASL Programming Language (Distributed Application Specification Language) is a high-level, strongly typed programming language originally developed at Sun Microsystems Laboratories between 1999 and 2003 as part of the Ace Project. The goals of the project were to enable rapid development of web-based applications based on Sun's J2EE architecture, and to eliminate the steep learning curve of platform-specific details.				
action!	https://en.wikipedia.org/wiki/Action!_(programming_language)	"Action! is a procedural programming language similar to ALGOL that is intended to produce high-performance programs for the Atari 8-bit family. The language was written by Clinton Parker and distributed on ROM cartridge by Optimized Systems Software (OSS) starting in 1983. It was one of the first of OSS's bank switching ""Super Cartridges"", with a total of 16 kB of code."	1983			
actionscript	https://en.wikipedia.org/wiki/ActionScript	ActionScript is an object-oriented programming language originally developed by Macromedia Inc. (later acquired by Adobe Systems). It is influenced by HyperTalk, the scripting language for HyperCard.[2] It is now an implementation of ECMAScript (meaning it is a superset of the syntax and semantics of the language more widely known as JavaScript), though it originally arose as a sibling, both being influenced by HyperTalk.	1998	['strong', 'static']	['Multi-paradigm', 'object-oriented', 'prototype-based', 'functional', 'imperative', 'scripting']	https://www.adobe.com/devnet/actionscript/articles/actionscript3_overview.html
actor	https://en.wikipedia.org/wiki/Actor_(programming_language)	The Actor programming language was invented by Charles Duff of The Whitewater Group in 1988. It was an offshoot of some object-oriented extensions to the Forth language he had been working on.				
ada	https://en.wikipedia.org/wiki/Ada_(programming_language)	Ada is a structured, statically typed, imperative, and object-oriented high-level programming language, extended from Pascal and other languages. It has built-in language support for design by contract (DbC), extremely strong typing, explicit concurrency, tasks, synchronous message passing, protected objects, and non-determinism. Ada improves code safety and maintainability by using the compiler to find errors in favor of runtime errors. Ada is an international technical standard, jointly defined by the International Organization for Standardization (ISO), and the International Electrotechnical Commission (IEC). As of 2020, the standard, called Ada 2012 informally,[7] is ISO/IEC 8652:2012.[8]	1980	['static', 'strong', 'safe', 'nominative']	['Multi-paradigm']	http://www.adaic.org/
adenine	https://en.wikipedia.org/wiki/Adenine_(programming_language)	Haystack is a project at the Massachusetts Institute of Technology to research and develop several applications around personal information management and the Semantic Web. The most notable of those applications is the Haystack client, a research personal information manager (PIM) and one of the first to be based on semantic desktop technologies. The Haystack client is published as open source software under the BSD license.				
advpl	https://en.wikipedia.org/wiki/AdvPL	AdvPL (Advanced Protheus Language) is a proprietary programming language based on xBase. It was released in 1999 and is used for development of applications in the ERP Protheus made by TOTVS.[2][1]				
agda	https://en.wikipedia.org/wiki/Agda_(theorem_prover)	Agda is a dependently typed functional programming language originally developed by Ulf Norell at Chalmers University of Technology with implementation described in his PhD thesis.[2] The original Agda system was developed at Chalmers by Catarina Coquand in 1999.[3] The current version, originally known as Agda 2, is a full rewrite, which should be considered a new language that shares a name and tradition.	1999	['strong', 'static', 'dependent', 'nominal', 'manifest', 'inferred']	['Functional']	http://wiki.portal.chalmers.se/agda
agilent vee	https://en.wikipedia.org/wiki/Agilent_VEE	Keysight VEE is a graphical dataflow programming software development environment from Keysight Technologies for automated test, measurement, data analysis and reporting. VEE originally stood for Visual Engineering Environment and developed by HP designated as HP VEE; it has since been officially renamed to Keysight VEE. Keysight VEE has been widely used in various industries, serving the entire stage of a product lifecycle, from design, validation to manufacturing. It is optimized in instrument control and automation with test and measurement devices such as data acquisition instruments like digital voltmeters and oscilloscopes, and source devices like signal generators and programmable power supplies.				http://www.keysight.com/find/vee
agora	https://en.wikipedia.org/wiki/Agora_(programming_language)	Agora is a reflective, prototype-based, object-oriented programming language that is based exclusively on message passing and not delegation. Agora was intended to show that even subject to that limit, it is possible to build a full object-oriented language that features inheritance, cloning and reflective operators.				
aimms	https://en.wikipedia.org/wiki/AIMMS	AIMMS (acronym for Advanced Interactive Multidimensional Modeling System) is a prescriptive analytics software company with offices in the Netherlands, United States, China and Singapore.				http://www.aimms.com/
aldor	https://en.wikipedia.org/wiki/Aldor	Aldor is a programming language. It is the successor of A# as the extension language of the Axiom computer algebra system.	1990		['Multi-paradigm', 'object-oriented', 'functional', 'imperative', 'dependent typed', 'logic']	http://www.aldor.org/
alef	https://en.wikipedia.org/wiki/Alef_(programming_language)	Alef is a discontinued concurrent programming language, designed as part of the Plan 9 operating system by Phil Winterbottom of Bell Labs. It implemented the channel-based concurrency model of Newsqueak in a compiled, C-like language.	1992	['Static', 'strong']	['compiled', 'concurrent', 'structured']	
alf	https://en.wikipedia.org/wiki/Algebraic_Logic_Functional_programming_language	Algebraic Logic Functional programming language, also known as ALF, is a programming language which combines functional and logic programming techniques. Its foundation is Horn clause logic with equality which consists of predicates and Horn clauses for logic programming, and functions and equations for functional programming.			['multi-paradigm', 'logic', 'functional']	http://www.informatik.uni-kiel.de/~mh/systems/ALF/README
algol 58	https://en.wikipedia.org/wiki/ALGOL_58	ALGOL 58, originally named IAL, is one of the family of ALGOL computer programming languages. It was an early compromise design soon superseded by ALGOL 60. According to John Backus[2]	1958	['Static', 'strong']	['procedural', 'imperative', 'structured']	
algol 60	https://en.wikipedia.org/wiki/ALGOL_60	ALGOL 60 (short for Algorithmic Language 1960) is a member of the ALGOL family of computer programming languages. It followed on from ALGOL 58 which had introduced code blocks and the begin and end pairs for delimiting them, representing a key advance in the rise of structured programming. ALGOL 60 was the first language implementing nested function definitions with lexical scope. It gave rise to many other programming languages, including CPL, Simula, BCPL, B, Pascal, and C. Practically every computer of the era had a systems programming language based on ALGOL 60 concepts.	1960	['Static', 'strong']	['procedural', 'imperative', 'structured']	
algol 68	https://en.wikipedia.org/wiki/ALGOL_68	ALGOL 68 (short for Algorithmic Language 1968) is an imperative programming language that was conceived as a successor to the ALGOL 60 programming language, designed with the goal of a much wider scope of application and more rigorously defined syntax and semantics.	1968	['static', 'strong', 'safe', 'structural']	['Multi-paradigm', 'concurrent', 'imperative']	
algol w	https://en.wikipedia.org/wiki/ALGOL_W	ALGOL W is a programming language. It is based on a proposal for ALGOL X by Niklaus Wirth and Tony Hoare as a successor to ALGOL 60 in International Federation for Information Processing (IFIP) IFIP Working Group 2.1 on Algorithmic Languages and Calculi, which specified, maintains, and supports the languages ALGOL 60 and ALGOL 68.[1] When the committee decided that the proposal was an insufficient advance over ALGOL 60, the proposal was published as A contribution to the development of ALGOL.[2] After making small modifications to the language[3] Wirth supervised a high quality implementation for the IBM System/360 at Stanford University that was widely distributed.[4]	1966	['Static', 'strong']	['Multi-paradigm', 'procedural', 'imperative', 'structured']	
alice	https://en.wikipedia.org/wiki/Alice_(programming_language)	Alice ML is a programming language designed by the Programming Systems Laboratory[2] at Saarland University, Saarbrücken, Germany. It is a dialect of Standard ML, augmented with support for lazy evaluation, concurrency (multithreading and distributed computing via remote procedure calls) and constraint programming.	2000	['strong', 'static', 'inferred']	['Multi-paradigm', 'imperative', 'functional', 'distributed', 'concurrent']	http://www.ps.uni-saarland.de/alice
alma-0	https://en.wikipedia.org/wiki/Alma-0	Alma-0 is a multi-paradigm computer programming language. This language is an augmented version of the imperative Modula-2 language with logic-programming features and convenient backtracking ability.[1] It is small, strongly typed, and combines constraint programming, a limited number of features inspired by logic programming and supports imperative paradigms. The language advocates declarative programming. The designers claim that search-oriented solutions built with it are substantially simpler than their counterparts written in purely imperative or logic programming style.[2] Alma-0 provides natural, high-level constructs for building search trees.[3]	1997	['static']	['multi-paradigm', 'constraint', 'imperative', 'logic']	http://www.cwi.nl/en/alma
ambienttalk	https://en.wikipedia.org/wiki/AmbientTalk	AmbientTalk is an experimental object-oriented distributed programming language developed at the Programming Technology Laboratory at the Vrije Universiteit Brussel, Belgium. The language is primarily targeted at writing programs deployed in mobile ad hoc networks.	2006	['dynamic', 'strong']	['object-oriented', 'prototype-based', 'Concurrent', 'Event-driven', 'Reflective']	http://soft.vub.ac.be/amop
amiga e	https://en.wikipedia.org/wiki/Amiga_E	Amiga E, or very often simply E, is a programming language created by Wouter van Oortmerssen on the Amiga. He has since moved on to develop the SHEEP programming language for the new AmigaDE platform and the CryScript language (also known as DOG) used during the development of the video game Far Cry.				
amos	https://en.wikipedia.org/wiki/AMOS_(programming_language)	AMOS BASIC is a dialect of the BASIC programming language implemented on the Amiga computer. AMOS BASIC was published by Europress Software and originally written by François Lionet with Constantin Sotiropoulos.	1990		['Imperative', 'Procedural']	https://web.archive.org/web/20120204085705/http://www.clickteam.com/eng/downloadcenter.php?i=58
ampl	https://en.wikipedia.org/wiki/AMPL	AMPL (A Mathematical Programming Language) is an algebraic modeling language to describe and solve high-complexity problems for large-scale mathematical computing (i.e., large-scale optimization and scheduling-type problems).[1] It was developed by Robert Fourer, David Gay, and Brian Kernighan at Bell Laboratories. AMPL supports dozens of solvers, both open source and commercial software, including CBC, CPLEX, FortMP, Gurobi, MINOS, IPOPT, SNOPT, KNITRO, and LGO. Problems are passed to solvers as nl files. AMPL is used by more than 100 corporate clients, and by government agencies and academic institutions.[2]	1985		['Multi-paradigm', 'declarative', 'imperative']	http://www.ampl.com/
angelscript	https://en.wikipedia.org/wiki/AngelScript	AngelScript is a game-oriented compiled scripting language.	2003	['static', 'strong']	['Multi-paradigm', 'scripting', 'imperative', 'procedural', 'object-oriented']	http://angelcode.com/angelscript
apache pig latin	https://en.wikipedia.org/wiki/Apache_Pig	Apache Pig[1] is a high-level platform for creating programs that run on Apache Hadoop. The language for this platform is called Pig Latin.[1] Pig can execute its Hadoop jobs in MapReduce, Apache Tez, or Apache Spark.[2] Pig Latin abstracts the programming from the Java MapReduce idiom into a notation which makes MapReduce programming high level, similar to that of SQL for relational database management systems. Pig Latin can be extended using user-defined functions (UDFs) which the user can write in Java, Python, JavaScript, Ruby or Groovy[3] and then call directly from the language.	2008			https://pig.apache.org/
apex	https://en.wikipedia.org/wiki/Apex_(programming_language)	Salesforce.com, Inc. is an American cloud-based software company headquartered in San Francisco, California. It provides customer relationship management (CRM) service and also provides a complementary suite of enterprise applications focused on customer service, marketing automation, analytics, and application development.				http://salesforce.com/
apl	https://en.wikipedia.org/wiki/APL_(programming_language)	APL (named after the book A Programming Language)[3] is a programming language developed in the 1960s by Kenneth E. Iverson. Its central datatype is the multidimensional array. It uses a large range of special graphic symbols[4] to represent most functions and operators, leading to very concise code. It has been an important influence on the development of concept modeling, spreadsheets, functional programming,[5] and computer math packages.[6] It has also inspired several other programming languages.[7][8]	1966	['Dynamic']	['Array', 'functional', 'structured', 'modular']	
app inventor for android's visual block language	https://en.wikipedia.org/wiki/App_Inventor_for_Android_(programming_language)	MIT App Inventor is a web application integrated development environment originally provided by Google, and now maintained by the Massachusetts Institute of Technology (MIT). It allows newcomers to computer programming to create application software(apps) for two operating systems (OS): Android, and iOS, which, as of 8 July 2019, is in final beta testing. It is free and open-source software released under dual licensing: a Creative Commons Attribution ShareAlike 3.0 Unported license, and an Apache License 2.0 for the source code.	2010			http://appinventor.mit.edu/
applescript	https://en.wikipedia.org/wiki/AppleScript	"AppleScript is a scripting language created by Apple Inc. that facilitates automated control over scriptable Mac applications. First introduced in System 7, it is currently included in all versions of macOS as part of a package of system automation tools.[2][3] The term ""AppleScript"" may refer to the language itself, to an individual script written in the language, or, informally, to the macOS Open Scripting Architecture that underlies the language.[2][3]"	1993	['Weak', 'dynamic']	['Natural language programming', 'Scripting']	https://developer.apple.com/library/content/documentation/AppleScript/Conceptual/AppleScriptX/AppleScriptX.html
apt	https://en.wikipedia.org/wiki/APT_(programming_language)	APT (Automatically Programmed Tool)[1] is a high-level computer programming language most commonly used to generate instructions for numerically controlled machine tools. Douglas T. Ross[2] is considered by many to be the father of APT: as head of the newly created Computer Applications Group of the Servomechanisms Laboratory at MIT in 1956, he led its technical effort. APT is a language and system that alleviates the tedious mathematics of writing toolpaths for numerically controlled equipment. This early language was used widely through the 1970s and is still a standard internationally.[3] Derivatives of APT were later developed.				
arc	https://en.wikipedia.org/wiki/Arc_(programming_language)	Arc is a programming language, a dialect of the language Lisp, developed by Paul Graham and Robert Morris. It is free and open-source software released under the Artistic License 2.0.	2008	['Dynamic']	['Multi-paradigm', 'functional', 'meta', 'procedural']	http://arclanguage.org/
arexx	https://en.wikipedia.org/wiki/ARexx	"ARexx is an implementation of the Rexx language for the Amiga, written in 1987 by William S. Hawes, with a number of Amiga-specific features beyond standard REXX facilities. Like most REXX implementations, ARexx is an interpreted language. Programs written for ARexx are called ""scripts"", or ""macros""; several programs offer the ability to run ARexx scripts in their main interface as macros."				
argus	https://en.wikipedia.org/wiki/Argus_(programming_language)	Argus is a programming language created at MIT by Barbara Liskov between 1982 and 1988, in collaboration with Maurice Herlihy, Paul Johnson, Robert Scheifler, and William Weihl.[1] It is an extension of the CLU language, and utilizes most of the same syntax and semantics.[1] Argus was designed to support the creation of distributed programs, by encapsulating related procedures within objects called guardians, and by supporting atomic operations called actions.[1][2]				
assembly language	https://en.wikipedia.org/wiki/Assembly_language	In computer programming, assembly language (or assembler language),[1] often abbreviated asm, is any low-level programming language in which there is a very strong correspondence between the instructions in the language and the architecture's machine code instructions.[2] Because assembly depends on the machine code instructions, every assembly language is designed for exactly one specific computer architecture. Assembly language may also be called symbolic machine code.[3][4]	1949		['Imperative', 'unstructured']	
autohotkey	https://en.wikipedia.org/wiki/AutoHotkey	AutoHotkey is a free, open-source custom scripting language for Microsoft Windows, initially aimed at providing easy keyboard shortcuts or hotkeys, fast macro-creation and software automation that allows users of most levels of computer skill to automate repetitive tasks in any Windows application. User interfaces can easily be extended or modified by AutoHotkey (for example, overriding the default Windows control key commands with their Emacs equivalents).[6] The AutoHotkey installation includes its own extensive help file, and web-based documentation is also available.[7]	2003			http://autohotkey.com/
autoit	https://en.wikipedia.org/wiki/AutoIt	AutoIt /ɔːtoʊ ɪt/[3] is a freeware programming language for Microsoft Windows. In its earliest release, it was primarily intended to create automation scripts (sometimes called macros) for Microsoft Windows programs[4] but has since grown to include enhancements in both programming language design and overall functionality.	1999		['Object-oriented', 'imperative', 'functional', 'procedural', 'reflective']	https://www.autoitscript.com/
autolisp / visual lisp	https://en.wikipedia.org/wiki/AutoLISP	AutoLISP is a dialect of the programming language Lisp built specifically for use with the full version of AutoCAD and its derivatives, which include AutoCAD Map 3D, AutoCAD Architecture and AutoCAD Mechanical.[1] Neither the application programming interface (API) nor the interpreter to execute AutoLISP code are included in the AutoCAD LT product line.[2]	1986			
averest	https://en.wikipedia.org/wiki/Averest	Averest is a synchronous programming language and set of tools to specify, verify, and implement reactive systems. It includes a compiler for synchronous programs, a symbolic model checker, and a tool for hardware/software synthesis.				
awk	https://en.wikipedia.org/wiki/AWK	AWK (awk)[4] is a domain-specific language designed for text processing and typically used as a data extraction and reporting tool. Like sed and grep, it is a filter,[4] and is a standard feature of most Unix-like operating systems.	1977		['Scripting', 'procedural', 'data-driven', '[1]']	
axum	https://en.wikipedia.org/wiki/Axum_(programming_language)	Axum (previously codenamed Maestro) is a domain-specific concurrent programming language, based on the Actor model, that was under active development by Microsoft[1] between 2009 and 2011.[2] It is an object-oriented language based on the .NET Common Language Runtime using a C-like syntax which, being a domain-specific language, is intended for development of portions of a software application that is well-suited to concurrency. But it contains enough general-purpose constructs that one need not switch to a general-purpose programming language (like C#) for the sequential parts of the concurrent components.[1]	2009			http://msdn.microsoft.com/en-us/devlabs/dd795202.aspx
